{
  "$schema": "http://json-schema.org/draft-07/schema#",
  "title": "Pack3d Input Schema",
  "type": "object",
  "required": ["container_types", "box_types"],
  "additionalProperties": false,
  "properties": {
    "container_types": {
      "type": "array",
      "minItems": 1,
      "items": {
        "type": "object",
        "required": ["id", "sx", "sy", "sz"],
        "additionalProperties": false,
        "properties": {
          "id": { "type": "string" },
          "sx": { "type": "integer", "minimum": 1 },
          "sy": { "type": "integer", "minimum": 1 },
          "sz": { "type": "integer", "minimum": 1 },
          "payload": { "type": ["number", "null"], "exclusiveMinimum": 0 },
          "quantity_limit": { "type": ["integer", "null"], "minimum": 1 },
          "obstacles": {
            "type": "array",
            "items": {
              "type": "object",
              "required": ["x", "y", "z", "dx", "dy", "dz"],
              "additionalProperties": false,
              "properties": {
                "x": { "type": "integer", "minimum": 0 },
                "y": { "type": "integer", "minimum": 0 },
                "z": { "type": "integer", "minimum": 0 },
                "dx": { "type": "integer", "minimum": 0 },
                "dy": { "type": "integer", "minimum": 0 },
                "dz": { "type": "integer", "minimum": 0 }
              }
            }
          },
          "facets": {
            "type": "array",
            "items": {
              "type": "object",
              "additionalProperties": false,
              "properties": {
                "dx": { "type": "integer" },
                "dy": { "type": "integer" },
                "dz": { "type": "integer" }
              }
            }
          }
        }
      }
    },
    "box_types": {
      "type": "array",
      "minItems": 1,
      "items": {
        "type": "object",
        "required": ["id", "sx", "sy", "sz", "allowed_orientations"],
        "additionalProperties": false,
        "properties": {
          "id": { "type": "string" },
          "sx": { "type": "integer", "minimum": 1 },
          "sy": { "type": "integer", "minimum": 1 },
          "sz": { "type": "integer", "minimum": 1 },
          "allowed_orientations": {
            "type": "array",
            "minItems": 1,
            "items": {
              "type": "string",
              "enum": ["xyz", "xzy", "yxz", "yzx", "zxy", "zyx"]
            }
          },
          "max_stack": {
            "oneOf": [
              { "type": "null" },
              { "type": "integer", "minimum": 1 },
              {
                "type": "array",
                "items": { "type": "integer", "minimum": 1 }
              }
            ]
          },
          "max_load": {
            "oneOf": [
              { "type": "null" },
              { "type": "number", "minimum": 0 },
              {
                "type": "array",
                "items": { "type": "number", "minimum": 0 }
              }
            ]
          },
          "weight": { "type": ["number", "null"], "exclusiveMinimum": 0 },
          "loose": { "type": "boolean", "default": false },
          "group": { "type": ["string", "null"], "minLength": 1 },
          "platform": { "type": ["string", "null"], "minLength": 1 },
          "danger": { "type": ["boolean", "null"] },
          "quantity": { "type": "integer", "minimum": 1 }
        }
      }
    },
    "boxes": {
      "type": "array",
      "minItems": 1,
      "items": {
        "type": "object",
        "required": ["id", "box_type_id"],
        "additionalProperties": false,
        "properties": {
          "id": { "type": "string" },
          "box_type_id": { "type": "string" },
          "weight": { "type": ["number", "null"], "exclusiveMinimum": 0 },
          "group": { "type": ["string", "null"], "minLength": 1 },
          "platform": { "type": ["string", "null"], "minLength": 1 },
          "danger": { "type": ["boolean", "null"] }
        }
      }
    },
    "route": {
      "type": "array",
      "items": { "type": "string" }
    },
    "pallet_types": {
      "type": "array",
      "minItems": 1,
      "items": {
        "type": "object",
        "required": ["id", "sx", "sy", "sz", "payload", "max_height"],
        "additionalProperties": false,
        "properties": {
          "id": { "type": "string" },
          "sx": { "type": "integer", "minimum": 1 },
          "sy": { "type": "integer", "minimum": 1 },
          "sz": { "type": "integer", "minimum": 1 },
          "payload": { "type": "number", "exclusiveMinimum": 0 },
          "max_height": { "type": "integer", "minimum": 1 },
          "self_weight": { "type": "number", "minimum": 0, "default": 0 },
          "platforms": {
            "type": ["array", "null"],
            "items": { "type": "string" },
            "description": "该托盘仅在列出的平台可用（空串也算普通平台）；缺省/空 = 全平台可用"
          }
        }
      }
    },
    "algorithm": {
      "type": "string",
      "enum": ["gep", "glc", "rgs", "bsg"],
      "default": "gep"
    },
    "constraints": {
      "type": "object",
      "additionalProperties": false,
      "properties": {
        "time_limit": {
          "type": "number",
          "exclusiveMinimum": 0,
          "default": 120
        },
        "support_rate": {
          "type": "number",
          "minimum": 0,
          "maximum": 1,
          "default": 0
        },
        "platform_limit": {
          "type": ["integer", "null"],
          "minimum": 1,
          "default": null
        },
        "tender_limit": {
          "type": ["integer", "null"],
          "minimum": 1,
          "default": null
        },
        "pallet_fallback": {
          "type": "boolean",
          "default": true
        },
        "pallet_support_rate": {
          "type": "number",
          "minimum": 0,
          "maximum": 1,
          "default": 1
        },
        "pallet_mix_group": {
          "type": "boolean"
        },
        "heavy_not_on_light": {
          "type": "boolean",
          "default": false
        }
      }
    },
    "existing_containers": {
      "type": "array",
      "items": {
        "type": "object",
        "required": ["type_id", "placements"],
        "additionalProperties": false,
        "properties": {
          "type_id": { "type": "string" },
          "placements": {
            "type": "array",
            "minItems": 1,
            "items": {
              "type": "object",
              "required": [
                "box_id",
                "box_type_id",
                "x",
                "y",
                "z",
                "orientation"
              ],
              "additionalProperties": false,
              "dependencies": {
                "dx": ["dy", "dz"],
                "dy": ["dx", "dz"],
                "dz": ["dx", "dy"]
              },
              "properties": {
                "box_id": { "type": "string" },
                "box_type_id": { "type": "string" },
                "x": { "type": "integer", "minimum": 0 },
                "y": { "type": "integer", "minimum": 0 },
                "z": { "type": "integer", "minimum": 0 },
                "orientation": {
                  "type": "string",
                  "enum": ["xyz", "xzy", "yxz", "yzx", "zxy", "zyx"]
                },
                "dx": { "type": "integer", "minimum": 1 },
                "dy": { "type": "integer", "minimum": 1 },
                "dz": { "type": "integer", "minimum": 1 },
                "weight": { "type": ["number", "null"], "exclusiveMinimum": 0 },
                "group": { "type": ["string", "null"], "minLength": 1 },
                "platform": { "type": ["string", "null"], "minLength": 1 },
                "danger": { "type": ["boolean", "null"] }
              }
            }
          }
        }
      }
    }
  },
  "allOf": [
    {
      "if": {
        "required": ["pallet_types"]
      },
      "then": {
        "required": ["constraints"],
        "properties": {
          "constraints": {
            "required": ["pallet_mix_group"]
          }
        }
      }
    },
    {
      "if": {
        "not": { "required": ["boxes"] }
      },
      "then": {
        "properties": {
          "box_types": {
            "items": { "required": ["quantity"] }
          }
        }
      }
    },
    {
      "if": {
        "required": ["boxes"]
      },
      "then": {
        "properties": {
          "box_types": {
            "items": { "not": { "required": ["quantity"] } }
          }
        }
      }
    }
  ]
}
