{
  "container_types": [
    {
      "id": "flight",
      "sx": 20,
      "sy": 10,
      "sz": 10,
      "facets": [
        { "dx": -10, "dz": -10 },
        { "dy": 8, "dz": -5 }
      ]
    }
  ],
  "box_types": [
    {
      "id": "cube",
      "sx": 5,
      "sy": 5,
      "sz": 5,
      "allowed_orientations": ["xyz"]
    }
  ],
  "boxes": [
    { "id": "c0", "box_type_id": "cube" },
    { "id": "c1", "box_type_id": "cube" },
    { "id": "c2", "box_type_id": "cube" },
    { "id": "c3", "box_type_id": "cube" },
    { "id": "c4", "box_type_id": "cube" },
    { "id": "c5", "box_type_id": "cube" },
    { "id": "c6", "box_type_id": "cube" },
    { "id": "c7", "box_type_id": "cube" }
  ],
  "constraints": {
    "time_limit": 30.0
  }
}
