{
  "container_types": [
    {
      "id": "truck",
      "sx": 6000,
      "sy": 2500,
      "sz": 2500,
      "payload": 20000
    }
  ],
  "box_types": [
    {
      "id": "loose",
      "sx": 60,
      "sy": 40,
      "sz": 30,
      "allowed_orientations": ["xyz"],
      "loose": true
    },
    {
      "id": "reg",
      "sx": 100,
      "sy": 100,
      "sz": 100,
      "allowed_orientations": ["xyz"]
    }
  ],
  "boxes": [
    { "id": "l1", "box_type_id": "loose", "weight": 5, "group": "A" },
    { "id": "l2", "box_type_id": "loose", "weight": 5, "group": "A" },
    { "id": "l3", "box_type_id": "loose", "weight": 5, "group": "A" },
    { "id": "l4", "box_type_id": "loose", "weight": 5, "group": "A" },
    { "id": "l5", "box_type_id": "loose", "weight": 5, "group": "A" },
    { "id": "l6", "box_type_id": "loose", "weight": 5, "group": "B" },
    { "id": "l7", "box_type_id": "loose", "weight": 5, "group": "B" },
    { "id": "l8", "box_type_id": "loose", "weight": 5, "group": "B" },
    { "id": "r1", "box_type_id": "reg", "weight": 10, "group": "R" },
    { "id": "r2", "box_type_id": "reg", "weight": 10, "group": "R" },
    { "id": "r3", "box_type_id": "reg", "weight": 10, "group": "R" },
    { "id": "r4", "box_type_id": "reg", "weight": 10, "group": "R" }
  ],
  "pallet_types": [
    {
      "id": "pt1200",
      "sx": 1200,
      "sy": 1000,
      "sz": 150,
      "payload": 1000,
      "max_height": 1500,
      "self_weight": 30
    }
  ],
  "constraints": {
    "time_limit": 60,
    "support_rate": 0.6,
    "pallet_mix_group": false
  },
  "algorithm": "gep"
}
