{
  "container_types": [
    { "id": "truck", "sx": 300, "sy": 200, "sz": 100, "payload": 100000.0 }
  ],
  "box_types": [
    {
      "id": "cube",
      "sx": 100,
      "sy": 100,
      "sz": 100,
      "allowed_orientations": ["xyz"]
    }
  ],
  "boxes": [
    { "id": "s1", "box_type_id": "cube", "weight": 10.0, "platform": "P1" },
    { "id": "s2", "box_type_id": "cube", "weight": 10.0, "platform": "P1" }
  ],
  "existing_containers": [
    {
      "type_id": "truck",
      "placements": [
        {
          "box_id": "d1",
          "box_type_id": "cube",
          "x": 0,
          "y": 0,
          "z": 0,
          "orientation": "xyz",
          "dx": 100,
          "dy": 100,
          "dz": 100,
          "platform": "P2"
        },
        {
          "box_id": "d2",
          "box_type_id": "cube",
          "x": 100,
          "y": 0,
          "z": 0,
          "orientation": "xyz",
          "dx": 100,
          "dy": 100,
          "dz": 100,
          "platform": "P2"
        },
        {
          "box_id": "d3",
          "box_type_id": "cube",
          "x": 0,
          "y": 100,
          "z": 0,
          "orientation": "xyz",
          "dx": 100,
          "dy": 100,
          "dz": 100,
          "platform": "P2"
        },
        {
          "box_id": "d4",
          "box_type_id": "cube",
          "x": 100,
          "y": 100,
          "z": 0,
          "orientation": "xyz",
          "dx": 100,
          "dy": 100,
          "dz": 100,
          "platform": "P2"
        }
      ]
    }
  ],
  "route": ["P1", "P2"]
}
