{
  "container_types": [
    {
      "id": "ct",
      "sx": 100,
      "sy": 100,
      "sz": 100,
      "payload": 5000.0,
      "quantity_limit": null
    }
  ],
  "box_types": [
    {
      "id": "bx1",
      "sx": 50,
      "sy": 50,
      "sz": 50,
      "allowed_orientations": ["xyz"],
      "weight": 10.0
    },
    {
      "id": "bx2",
      "sx": 20,
      "sy": 20,
      "sz": 20,
      "allowed_orientations": ["xyz"],
      "weight": 20.0
    }
  ],
  "boxes": [
    { "id": "a1", "box_type_id": "bx1" },
    { "id": "a2", "box_type_id": "bx1" },
    { "id": "a3", "box_type_id": "bx1" },
    { "id": "b1", "box_type_id": "bx2" },
    { "id": "b2", "box_type_id": "bx2" }
  ],
  "constraints": {
    "time_limit": 120.0,
    "support_rate": 0.0,
    "platform_limit": null,
    "tender_limit": null
  }
}
