{
  "container_types": [
    { "id": "big", "sx": 100, "sy": 100, "sz": 100, "payload": 100000.0 }
  ],
  "box_types": [
    {
      "id": "dgr",
      "sx": 30,
      "sy": 30,
      "sz": 30,
      "allowed_orientations": ["xyz"],
      "danger": true
    },
    {
      "id": "reg",
      "sx": 20,
      "sy": 20,
      "sz": 20,
      "allowed_orientations": ["xyz"],
      "danger": false
    }
  ],
  "boxes": [
    { "id": "d2", "box_type_id": "dgr" },
    { "id": "r1", "box_type_id": "reg" }
  ],
  "existing_containers": [
    {
      "type_id": "big",
      "placements": [
        {
          "box_id": "d1",
          "box_type_id": "dgr",
          "x": 0,
          "y": 0,
          "z": 0,
          "orientation": "xyz",
          "dx": 30,
          "dy": 30,
          "dz": 30,
          "danger": true
        }
      ]
    }
  ],
  "algorithm": "gep",
  "constraints": { "time_limit": 30.0 }
}
