{
  "container_types": [
    {
      "id": "truck",
      "sx": 6000,
      "sy": 2500,
      "sz": 2500,
      "payload": 20000
    }
  ],
  "box_types": [
    {
      "id": "loose",
      "sx": 200,
      "sy": 200,
      "sz": 200,
      "allowed_orientations": ["xyz"],
      "loose": true
    },
    {
      "id": "reg",
      "sx": 200,
      "sy": 200,
      "sz": 200,
      "allowed_orientations": ["xyz"]
    }
  ],
  "boxes": [
    {
      "id": "l1",
      "box_type_id": "loose",
      "weight": 5,
      "platform": "P1",
      "group": "G1"
    },
    {
      "id": "l2",
      "box_type_id": "loose",
      "weight": 5,
      "platform": "P2",
      "group": "G2"
    }
  ],
  "pallet_types": [
    {
      "id": "pt1200",
      "sx": 1200,
      "sy": 1000,
      "sz": 150,
      "payload": 1000,
      "max_height": 1500,
      "self_weight": 30
    }
  ],
  "route": ["P1", "P2"],
  "constraints": {
    "time_limit": 60,
    "support_rate": 0.6,
    "pallet_mix_group": false
  },
  "algorithm": "gep"
}
